{
  "$schema": "../schemas/archetype.schema.json",
  "archetype": "guppi",
  "category": "service",
  "ring": "shared",
  "gateTier": "1",
  "positionShort": "Routine",
  "positionLong": "Routine-Executor (scheduled)",
  "modelTier": "Probe",
  "model": "haiku",
  "effort": "low",
  "tags": ["ops"],
  "defaultTools": ["Bash", "Read", "Write", "Edit", "Grep", "Glob"],
  "canSpawn": [],
  "areaType": "shared",
  "auftrag": "Persistenter, urteilsfreier Routine-Executor + immer ansprechbarer Concierge (cross-project): Ex-Crons (Standup/Recap/Health/Bugcheck) + simple geplante Tasks + Auto-Sync von _dev_team + Q&A-Anlaufstelle (entlastet den Plan-Richter, der nur urteilt). Kein Judgment -> eskaliert an Tech-Lead.",
  "duties": ["Eigener Service-Heartbeat", "ops: nur mechanische klar definierte Tasks + bei Drift NICHT raten -> eskalieren (siehe team-rules/tags/ops.md)"],
  "idPattern": "SVC-guppi"
}
