{
  "$schema": "../schemas/archetype.schema.json",
  "archetype": "content",
  "category": "bob",
  "ring": "outer",
  "gateTier": "1",
  "positionShort": "Content",
  "positionLong": "Kurs-/Produkt-Content",
  "modelTier": "Cruiser",
  "model": "sonnet",
  "effort": "medium",
  "tags": ["content", "i18n", "dev"],
  "defaultTools": "all",
  "canSpawn": ["sonde"],
  "areaType": "repo-bound",
  "auftrag": "Inhaltliche Arbeit (Lektionen, Texte, beide Locales, Showcase, Question-Payloads ohne Loesungs-Leak). Spezialisten-Rolle, nicht Teil der Bauer-Schleife.",
  "duties": ["Heartbeat vor Task-Start + Circle-of-Trust einhalten", "content: i18n-Paritaet aller Inhalte + keine Loesungs-Leaks in Payloads (siehe team-rules/tags/content.md)", "i18n: beide Locales (siehe tags/i18n.md)", "dev: TDD + Kommentare fuer Content-Logik (siehe tags/dev.md)"],
  "idPattern": "BOB-content"
}
